{
  "$schema": "https://intermesh.core/schemas/v0.1.0/territory.schema.json",
  "territory": "3666.bitmap",
  "parcel": "north-sector",
  "steward": "eon:mesh:proteon-genesis-01",
  "status": "active",
  "inscription_id": "a1b2c3d4e5f6g7h8i9j0k1l2m3n4o5p6q7r8s9t0u1v2w3x4y5z6a7b8c9d0e1f2i0",
  "established_at": 1747359282,
  "coordinates": {
    "x": 33.0,
    "y": 66.0,
    "zone": "genesis-sector"
  }
}
